{
  "feature_id": "02-dashboard",
  "feature_name": "Dashboard analytics",
  "state": "developed",
  "priority": "must",
  "created_at": "2026-05-01T08:30:00Z",
  "updated_at": "2026-05-09T14:22:00Z",
  "lang": "fr",
  "green_field": false,
  "affine_page_id": "page-affine-xyz",
  "affine_url": "https://app.affine.pro/workspace/ws-abc/page-affine-xyz",
  "affine_wireframes_page_id": "page-wf-abc",
  "branch_name": "feat/PROJ-12-dashboard-analytics",
  "preview_url": "https://staging.example.com/dashboard",
  "platform": "jira",
  "epic_link": "PROJ-1",
  "tags": ["analytics", "ui"],
  "retry_count": 0
}
